{
  "schemaVersion": 1,
  "kind": "training",
  "title": "Yoddha prep: pilot week (13-19 Oct)",
  "planKey": "yoddha_prep_training",
  "versionNote": "Pilot week, approved 13 Oct 2026. Revised after an independent review: Saturday rest and Sunday run, sled ladder capped at RPE 8 / 130 kg, 24 kg carry test moved to week 2, box-jump practice before Friday, easier Monday runs.",
  "status": "approved",
  "startDate": "2026-10-13",
  "endDate": "2026-10-19",
  "assumptions": [
    "Aryan's run, strength and station levels are unknown until this week's tests; his starting loads (80 kg sled push, 70 kg sled pull, 2 x 16 kg carry, 10 kg lunge) are assumptions.",
    "Both partners run every 700 m together. The rulebook doesn't say so; this follows the HYROX convention until the organisers confirm.",
    "Rower 'Resistance 7' is assumed to mean Concept2 damper 7.",
    "Chinmay's longest run in the 30 days before the pilot was 5.76 km (4 Oct)."
  ],
  "athletes": [
    "chinmay",
    "aryan"
  ],
  "eventCategory": "yoddha_s3_mumbai_2026/mens_doubles",
  "sessions": [
    {
      "date": "2026-10-13",
      "athletes": [
        "chinmay",
        "aryan"
      ],
      "joint": true,
      "type": "strength",
      "title": "Lower-body strength + sled push",
      "objective": "Build leg strength for the sled and lunges, find the heaviest sled load you can push at a steady pace, and practise legal sled turns. Target effort RPE 6-7, nothing maximal.",
      "estimatedMinutes": 65,
      "warmup": [
        "3 min easy row or bike",
        "Leg swings 10 per side, forward and sideways",
        "10 bodyweight squats, 10 walking lunges, 10 glute bridges, 5 inchworms",
        "2 light ramp-up sets of the squat"
      ],
      "blocks": [
        {
          "name": "Strength",
          "exercises": [
            {
              "name": "Back squat or goblet squat",
              "category": "strength",
              "sets": 4,
              "reps": 6,
              "restSec": 120,
              "targetRpe": "7",
              "load": {
                "guidance": "About a 9-rep max; add 2.5-5 kg per set while RPE stays at 7 or below"
              },
              "notes": "Write down the final weight.",
              "perAthlete": {
                "aryan": {
                  "notes": "Use a goblet squat (dumbbell or kettlebell at the chest) if barbell form isn't solid."
                }
              }
            },
            {
              "name": "Romanian deadlift",
              "category": "strength",
              "sets": 3,
              "reps": 8,
              "restSec": 90,
              "targetRpe": "7",
              "load": {
                "guidance": "Barbell or dumbbells at RPE 7"
              },
              "notes": "Hinge at the hips, back flat, bar close to the legs, lower to mid-shin."
            }
          ]
        },
        {
          "name": "Stations",
          "exercises": [
            {
              "name": "Sandbag walking lunge",
              "category": "lunge",
              "sets": 3,
              "distanceM": 20,
              "restSec": 90,
              "targetRpe": "6-7",
              "load": {
                "kg": 20,
                "guidance": "Across both shoulders"
              },
              "notes": "Race standard on every rep: back knee touches the floor, stand up fully, alternate legs. The rulebook lists +5 min for a knee that doesn't touch, so the partner watches for it.",
              "perAthlete": {
                "aryan": {
                  "load": {
                    "guidance": "Start at 10 kg or bodyweight (assumption); 20 kg once every rep is clean"
                  }
                }
              }
            },
            {
              "name": "Sled push ladder",
              "category": "sled_push",
              "sets": 6,
              "targetRpe": "7-8",
              "load": {
                "guidance": "Start ~100 kg, +10 kg per push; stop at RPE 8; cap 130 kg this week"
              },
              "notes": "One lane (about 12-15 m) per push, taking turns, which gives each of you 60-90 s rest. Stop the ladder when a push feels like RPE 8 or the sled clearly slows; never push to a stall. The sled fully crosses the line before you turn, and you always face the direction of travel. Record the heaviest load pushed at a steady pace.",
              "perAthlete": {
                "aryan": {
                  "load": {
                    "guidance": "Start ~80 kg (assumption), +10 kg per push; stop at RPE 8"
                  }
                }
              }
            }
          ]
        },
        {
          "name": "Core",
          "exercises": [
            {
              "name": "Dead bug",
              "category": "strength",
              "sets": 2,
              "reps": 8,
              "notes": "8 per side."
            },
            {
              "name": "Side plank",
              "category": "strength",
              "sets": 2,
              "durationSec": 30,
              "notes": "30 s per side."
            }
          ]
        }
      ],
      "cooldown": [
        "3 min easy walk",
        "Stretch calves, hip flexors, hamstrings, quads and lats, 30 s each side",
        "1 min slow breathing"
      ],
      "recovery": "Legs will feel this on Wednesday, so keep Wednesday's run truly easy. Aryan: if you run in the morning, keep it easy (RPE 3-4, 40 min max).",
      "stopCriteria": [
        "Chest pain or pressure, fainting or near-fainting, dizziness that doesn't settle, palpitations, breathlessness far out of proportion to the effort, or confusion: stop training and get medical advice before training again.",
        "Heat illness signs (headache, nausea, chills in the heat, cramps, unusual weakness, sweating that stops): stop, get somewhere cool, sip water or ORS, and get help if not better in about 15 minutes.",
        "Sharp or joint pain, pain that changes how you move, or pain that gets worse: stop that exercise."
      ],
      "lighterOption": "Squat and RDL 2 sets each, lunges 2 x 20 m bodyweight, sled 4 pushes at your ladder starting load, no ladder."
    },
    {
      "date": "2026-10-14",
      "athletes": [
        "chinmay",
        "aryan"
      ],
      "joint": true,
      "type": "run",
      "title": "Easy run-walk + row, wall-ball and box-jump technique",
      "objective": "Aerobic base at an easy pace, learning to run as a pair, and first technique practice on the rower, wall balls and box jumps.",
      "estimatedMinutes": 60,
      "warmup": [
        "Brisk walk 3 min",
        "Leg swings",
        "A-skips 2 x 15 m",
        "Ankle hops 2 x 10"
      ],
      "blocks": [
        {
          "name": "Run",
          "exercises": [
            {
              "name": "Run-walk together",
              "category": "run",
              "sets": 1,
              "distanceM": 3000,
              "targetRpe": "3-4",
              "notes": "Run 4 min / walk 1 min. You should be able to speak in full sentences. Chinmay decides when to walk; Aryan matches his pace. Stop at 3 km even if you feel good. Note total time and number of walk breaks."
            }
          ]
        },
        {
          "name": "Technique",
          "exercises": [
            {
              "name": "Row technique",
              "category": "row",
              "sets": 3,
              "durationSec": 120,
              "restSec": 60,
              "targetRpe": "4-5",
              "load": {
                "guidance": "Damper 7 (assumed race setting)"
              },
              "notes": "Stroke rate 22-26. Legs, then body, then arms on the drive; arms, then body, then legs on the way back. Write down the drag factor at damper 7."
            },
            {
              "name": "Wall-ball technique",
              "category": "wall_ball",
              "sets": 5,
              "reps": 6,
              "restSec": 60,
              "targetRpe": "5",
              "load": {
                "kg": 6,
                "guidance": "9 ft target, or the nearest target your gym has"
              },
              "notes": "Hips below knees on every rep; catch the ball and drop straight into the next squat in one flow. The partner calls no-reps."
            },
            {
              "name": "Box-jump practice",
              "category": "box_jump",
              "sets": 3,
              "reps": 5,
              "restSec": 60,
              "targetRpe": "4",
              "notes": "40-50 cm box. Two-foot take-off and landing, stand tall on top, step down. Prepares you for Friday's check."
            }
          ]
        }
      ],
      "cooldown": [
        "3 min easy walk",
        "Stretch calves, hip flexors, hamstrings, quads and lats, 30 s each side",
        "1 min slow breathing"
      ],
      "recovery": "Easy day: it should leave you fresher, not tired.",
      "stopCriteria": [
        "Chest pain or pressure, fainting or near-fainting, dizziness that doesn't settle, palpitations, breathlessness far out of proportion to the effort, or confusion: stop training and get medical advice before training again.",
        "Heat illness signs (headache, nausea, chills in the heat, cramps, unusual weakness, sweating that stops): stop, get somewhere cool, sip water or ORS, and get help if not better in about 15 minutes.",
        "Sharp or joint pain, pain that changes how you move, or pain that gets worse: stop that exercise."
      ],
      "lighterOption": "2 km run-walk (3 min run / 1 min walk); skip the wall balls and box jumps."
    },
    {
      "date": "2026-10-15",
      "athletes": [
        "chinmay",
        "aryan"
      ],
      "joint": true,
      "type": "strength",
      "title": "Upper body + sled pull + carries",